{
  "item_id": "ci_w1_xhs_relationship",
  "campaign_id": "cmp_xintong_festival_2026",
  "channel": "xiaohongshu",
  "template_type": "seeding_truth_breaking",
  "language": "zh-CN",
  "headline": "一个公益书院，凭什么要「配」一家公司？｜心同共生 90 秒讲透",
  "hook": "很多人一听「书院 + 公司」就皱眉：是不是又要割韭菜了？",
  "body_copy": "🤔 最大的误会：书院=获客渠道？公司=书院的商业部门？\n\n✅ 真相：定慧一体，隔离而协同——这是一套跨越百年的双轮文明工程。\n\n🏛️ 书院守公心（公益/非营利）\n· 守护公心教育与文化信任场\n· 课程、讲师、公益公信力\n\n🌱 共生造妙用（社会企业）\n· 连资源、做产品、建平台、强造血\n· 依法依规反哺公益\n\n🔒 六条隔离线，全部 SOP 化\n法律主体｜账户票据｜场域传播｜人员薪酬｜数据 CRM｜品牌知识产权\n\n📌 退出自由不可绑定\n不买、不捐、不加入，照样安心参加公益学习。\n\n一个让你「安住本心」，一个帮你「生起妙用」——明白、做到、利他、共生，一步都不能跳。",
  "key_benefits": [
    "公益与商业「隔离而协同」，不是混同",
    "六条隔离线已 SOP 化，公开透明",
    "退出自由，公益学习不绑定任何消费"
  ],
  "cta": {
    "text": "看 96s 品牌片，评论区聊聊你怎么看「公益与商业」的关系",
    "destination_type": "dm"
  },
  "hashtags": [
    "心同共生", "心同书院", "公益与商业", "社会企业", "启世人公心",
    "化世界大同", "定慧一体", "传统文化", "首届文化节"
  ],
  "visual_brief_ref": "vb_w1_relationship_diagram",
  "status": "draft"
}
