{
  "item_id": "ci_w1_blog_relationship",
  "campaign_id": "cmp_xintong_festival_2026",
  "channel": "blog_seo",
  "template_type": "deepdive_authority_guide",
  "language": "zh-CN",
  "headline": "心同书院 × 心同共生：定慧一体，隔离而协同（深度解读）",
  "hook": "公益与商业，如何在不混同的前提下彼此成就？这是很多社会创新项目回答不了的问题。",
  "body_copy": "# 心同书院 × 心同共生：定慧一体，隔离而协同\n\n## 一、为什么是「双主体」而不是「公益项目 + 一家公司」\n\n心同书院与心同共生，不是公益项目配一家公司的松散组合，而是一套跨越百年的双轮文明工程：书院守护纯粹的公心教育与文化信任场，共生建立可持续的商业造血与社会创新能力。两者使命相通、法律独立、财务隔离、治理协同、公开透明。\n\n## 二、定与慧：两个主体的分工\n\n- 心同书院（公益主体 / 非营利）——守文化、守公益、育人才、建公信，帮人「安住本心」（定）；\n- 心同共生（社会企业）——连资源、做产品、建平台、强造血，帮人「生起妙用」（慧）。\n\n共同构成「明白 → 做到 → 利他 → 共生」四步完整路径，四步不能跳跃。\n\n## 三、六条隔离线：协同而不混同的制度保障\n\n法律主体、账户与票据、场域与传播、人员与薪酬、数据与 CRM、品牌与知识产权，六条隔离线全部分开，并配套立项前核查、月度财务复核、月度工时披露等检查动作。\n\n## 四、反哺制度化：让公益有长期生命力\n\n采取「基础公益预算 + 盈利后比例捐赠 + 专项共同项目」三种方式，资金流须满足经审计、经批准、有协议、可追踪、有报告五项条件。\n\n## 五、首年协同元年：2026.9.28 首届文化节\n\n协同元年起点为 2026 年 9 月 28 日首届一日文化节暨祭孔大典。欢迎关注，共同见证。",
  "key_benefits": [
    "双主体定位清晰，边界明确",
    "六条隔离线制度 + 月度复核机制",
    "反哺五条件 + 四形式，公开透明"
  ],
  "cta": {
    "text": "关注公众号，预约 9.28 文化节",
    "destination_type": "website_rfq",
    "link": "https://example.com/festival"
  },
  "hashtags": [
    "心同共生", "心同书院", "社会企业", "公益创新", "启世人公心", "文化节"
  ],
  "visual_brief_ref": "vb_w1_relationship_diagram",
  "status": "draft"
}
