{
  "item_id": "ci_w1_wxvideo_relationship",
  "campaign_id": "cmp_xintong_festival_2026",
  "channel": "wechat_video",
  "template_type": "trust_owner_ip",
  "language": "zh-CN",
  "headline": "书院和公司，为什么必须「隔离」？3 分钟讲清心同共生",
  "hook": "我们做了一套双轮文明工程，很多人看不懂——今天就一次讲清楚。",
  "body_copy": "很多人问：你们书院和公司，到底什么关系？\n\n一句话：定慧一体，隔离而协同。\n\n书院不是共生的获客渠道，共生也不是书院的商业部门。\n\n🏛️ 书院守公心——安住本心（定）\n🌱 共生造妙用——生起妙用（慧）\n\n两者使命相通，却法律独立、财务隔离、治理协同、公开透明。\n\n反哺不是说说而已：经审计、经批准、有协议、可追踪、有报告，五条缺一不可。\n\n2026 年 9 月 28 日，首届一日文化节暨祭孔大典，欢迎你到现场，亲自看一看这套体系怎么运转。",
  "key_benefits": [
    "双主体边界清晰，公开透明",
    "反哺机制五条件锁死，杜绝虚假承诺",
    "文化节可现场见证"
  ],
  "cta": {
    "text": "9 月 28 日首届文化节，预约直播 / 现场见",
    "destination_type": "website_rfq",
    "link": "https://example.com/festival"
  },
  "hashtags": [
    "心同共生", "心同书院", "社会企业", "公益", "文化节", "祭孔大典"
  ],
  "visual_brief_ref": "vb_w1_relationship_diagram",
  "video_storyboard": {
    "duration_seconds": 15,
    "aspect_ratio": "9:16",
    "background_music_mood": "Warm contemplative guqin + soft ambient (克制静谧，东方文化质感)",
    "scenes": [
      {
        "scene_number": 1,
        "duration_sec": 3.0,
        "visual_prompt": "朱红渐变底，墨色大字自下而上淡入「书院和公司，为什么必须隔离？」",
        "b_roll_description": "纯文字卡点，无实拍",
        "narration_text": "书院和公司，为什么必须隔离？",
        "subtitle_overlay": "书院 × 共生",
        "camera_motion": "Static title, slow push-in"
      },
      {
        "scene_number": 2,
        "duration_sec": 4.0,
        "visual_prompt": "两枚朱红印章圆环并排浮现：左「心同书院·守公心」，右「心同共生·造妙用」，中间一条赭金细线分开又相连",
        "b_roll_description": "品牌片 Remotion 版双主体画面截取",
        "narration_text": "书院守公心，共生造妙用。定慧一体，隔离而协同。",
        "subtitle_overlay": "定慧一体 · 隔离而协同",
        "camera_motion": "Slow pan left to right"
      },
      {
        "scene_number": 3,
        "duration_sec": 4.0,
        "visual_prompt": "六条赭金隔离线依次划入：法律主体、账户票据、场域传播、人员薪酬、数据、品牌知识产权",
        "b_roll_description": "六条隔离线信息图动画",
        "narration_text": "六条隔离线，全部分开，公开透明。",
        "subtitle_overlay": "六条隔离线 SOP",
        "camera_motion": "Sequential wipe, one line at a time"
      },
      {
        "scene_number": 4,
        "duration_sec": 4.0,
        "visual_prompt": "米白宣纸底，朱红大字「2026.9.28 首届一日文化节」+ 赭金 CTA 按钮「预约直播」",
        "b_roll_description": "封面海报底图 + CTA 文字",
        "narration_text": "9 月 28 日，首届文化节，欢迎你到现场亲自见证。",
        "subtitle_overlay": "2026.9.28 首届文化节",
        "camera_motion": "Static hero lock-off, soft zoom to CTA"
      }
    ]
  },
  "status": "draft"
}
